"好好爱这个世界呀奋斗在前线的人 想抱抱你们没有什么岁月静好 我们现在可以如此安全是有人在负重前行呀武汉加油！中国加油！共度难关<img alt=""[打call]"" class=""small"" src=""//i0.hdslb.com/bfs/emote/431432c43da3ee5aab5b0e4f8931953e649e9975.png@100w_100h.webp""/><img alt=""[奋斗]"" class=""small"" src=""//i0.hdslb.com/bfs/emote/bb2060c15dba7d3fd731c35079d1617f1afe3376.png@100w_100h.webp""/>";
听到武汉解封就突然泪崩了;
此生无悔入华夏，来世还在种花家！;
这可以呀餐饮业要续命没办法武汉加油;
一家11人感染，三个重症，全部救回;
泪流满面！纵然有方方及其支持者卖国求荣，更多的人民撑起了我们这个伟大的国家、伟大的民族。;
咳 但凡有点良知的都会感动的 我们中国人真的太棒了;
这次疫情中国有两大收获，第一点：中国人民更加坚信自己政府和政策是优越的，而且中国自豪的从来我们是大国转变为我们是优越制度的国家，我们的政府至少把我们当一条条鲜活的生命。第二点增加了中国对世界的影响力，告诉了世界共产党和制度的不同并不能阻碍人类命运共同体;
"我记得，前些年，外国一个政客说中国是一个没有信仰的国家，一个没有信仰的国家是很悲哀的，说什么美国有教堂什么的，吧啦吧啦的说了一堆！现在呢？他们的信仰呢？他们信仰神在哪里？他们的信仰为什么不救那些患病的人？可笑，可悲，可怜！中国的信仰就是团结，中国的信仰就是生命高于一切，那些污蔑我们的让他们继续沉浸在无知与偏见中吧，我觉得这次疫情已经很好的解释了一切！中国，真的很棒<img alt=""[星星眼]"" class=""small"" src=""//i0.hdslb.com/bfs/emote/63c9d1a31c0da745b61cdb35e0ecb28635675db2.png@100w_100h.webp""/>";
"这次疫情最感人的是1.突然全中国都更爱国了，以前还有很多人喜欢质疑我们制度对不对，现在大家都知道了。2.政府愿意为健康危机牺牲经济，且实行免费治疗，再一次向我们证明人民是第一位。3.在困难出现时，前线的中国人永远原因出来为集体付出，大部分人没有私心，不会想是否值得。4.接受帮助的人民拥有感恩的心，滴水之恩涌泉相报，前线英雄心里才不后悔。5.政府在执行控制疫情过程中，不停根据各方专家意见，及人民反应抱怨赞赏支持等各种声音去修改政策，使得大家都能团结配合，并且奖罚分明，促进了地方政府办事能力。6.作为一名中国人，我深深地爱上了你们了，很高兴能跟大家成为同胞，希望下辈子下下辈子下下下辈子……我仍跟大家成为亲友，爱你们！<img alt=""[爱心]"" class=""small"" src=""//i0.hdslb.com/bfs/emote/ed04066ea7124106d17ffcaf75600700e5442f5c.png@100w_100h.webp""/><img alt=""[爱心]"" class=""small"" src=""//i0.hdslb.com/bfs/emote/ed04066ea7124106d17ffcaf75600700e5442f5c.png@100w_100h.webp""/><img alt=""[爱心]"" class=""small"" src=""//i0.hdslb.com/bfs/emote/ed04066ea7124106d17ffcaf75600700e5442f5c.png@100w_100h.webp""/>";
"虽然我不是中国人，但看了视频，我很感动。。虽然我国籍不是中国，但很庆幸我会华语，也会中华文化来了解中国<img alt=""[大哭]"" class=""small"" src=""//i0.hdslb.com/bfs/emote/2caafee2e5db4db72104650d87810cc2c123fc86.png@100w_100h.webp""/><img alt=""[大哭]"" class=""small"" src=""//i0.hdslb.com/bfs/emote/2caafee2e5db4db72104650d87810cc2c123fc86.png@100w_100h.webp""/><img alt=""[大哭]"" class=""small"" src=""//i0.hdslb.com/bfs/emote/2caafee2e5db4db72104650d87810cc2c123fc86.png@100w_100h.webp""/>";
借用视频里的评论:湖北人民禁足为全国抗疫赢得了时间。英雄的湖北人民！现在又隆重送别最可爱的逆行人。重情重义。所以，也谢谢武汉人民、湖北人民！爱你们！❤;
每个省援助一个市简直是神决策;
此生不悔入华夏，来世还做中国人;
"一次次危难面前，十几亿人握成一个拳头！试问谁能吃我一拳！<img alt=""[鼓掌]"" class=""small"" src=""//i0.hdslb.com/bfs/emote/895d1fc616b4b6c830cf96012880818c0e1de00d.png@100w_100h.webp""/><img alt=""[鼓掌]"" class=""small"" src=""//i0.hdslb.com/bfs/emote/895d1fc616b4b6c830cf96012880818c0e1de00d.png@100w_100h.webp""/><img alt=""[鼓掌]"" class=""small"" src=""//i0.hdslb.com/bfs/emote/895d1fc616b4b6c830cf96012880818c0e1de00d.png@100w_100h.webp""/>";
"都是人，怎么中国人那么优秀！！为自己身为中国人一辈子骄傲着，为这个身份骄傲着，大爱中国，为祖国繁荣昌盛而努力奋斗！！<img alt=""[加油武汉]"" class=""small"" src=""//i0.hdslb.com/bfs/emote/eb966aaa5b690d3f9308a9f936f5b5a72a7f956b.png@100w_100h.webp""/><img alt=""[加油武汉]"" class=""small"" src=""//i0.hdslb.com/bfs/emote/eb966aaa5b690d3f9308a9f936f5b5a72a7f956b.png@100w_100h.webp""/><img alt=""[加油武汉]"" class=""small"" src=""//i0.hdslb.com/bfs/emote/eb966aaa5b690d3f9308a9f936f5b5a72a7f956b.png@100w_100h.webp""/>";
2019的中国：我们人类应该像《流浪地球》这样，团结一心，饱和救援。2020的中国：劳资说到做到！;
如果没有那些个别的老鼠屎，我中国就是圣地了;
"中国牛逼了，为他们点赞，我是真的没有这勇气，除了佩服，还有敬畏，感谢你们，一大早就让人落泪，真是的<img alt=""[委屈]"" class=""small"" src=""//i0.hdslb.com/bfs/emote/d2f26cbdd6c96960320af03f5514c5b524990840.png@100w_100h.webp""/>";
超感动的。;
我们华夏民族，什么风浪没见过。我们华夏民族，与其说是个民族不如说是一种文明，一种刻到骨子里的信仰。;
这就是中国🇨🇳一方有难八支援;
国家强大，说话就是硬气。;
如果其他国家想抄中国作业，那么你需要以下几点：1.中国果断的态度2.中国严厉的措施3.14亿人民强大的凝聚力4.中国优秀的领导人5.中国的经济基础6.14亿人民强大的自制力7.中国医护人员的贡献8.中国速度9.中国努力的科研人员加油吧;
"此生无悔入华夏，来世愿在种花家。🇨🇳一场疫情，让我们明白，我们的祖国，真的真的超级伟大。武汉加油<img alt=""[加油武汉]"" class=""small"" src=""//i0.hdslb.com/bfs/emote/eb966aaa5b690d3f9308a9f936f5b5a72a7f956b.png@100w_100h.webp""/>中国加油    世界加油。";
"好笑的是，我在国内最紧张的时候都没有抢货囤货，只买了比平时多一点点。到了国外，抢都抢不到<img alt=""[笑]"" class=""small"" src=""//i0.hdslb.com/bfs/emote/81edf17314cea3b48674312b4364df44d5c01f17.png@100w_100h.webp""/><img alt=""[笑]"" class=""small"" src=""//i0.hdslb.com/bfs/emote/81edf17314cea3b48674312b4364df44d5c01f17.png@100w_100h.webp""/>";
啥都不要说，中国牛逼。;
无论我身在何地，我都能自豪的说出：“我是中国人！”🇨🇳🇨🇳🇨🇳;
沉睡的狮子该醒了 全球疫情下各国迷惑抗疫行为，中国在顺势崛起！;
为何中国是四大文明古国里面唯一一个留存至今的，也许这就是原因。;
我记得温总理有句话，多难兴邦！;
"任何困难都难不倒英雄的中国人民<img alt=""[爱心]"" class=""small"" src=""//i0.hdslb.com/bfs/emote/ed04066ea7124106d17ffcaf75600700e5442f5c.png@100w_100h.webp""/>";
我的祖国总是让我热泪盈眶;
我为我是一个中国人而永远感到骄傲自豪，我爱你中国！;
起来，不愿意做奴隶的中国人！！！！;
"中国正在崛起，没有任何人任何力量可以阻挡<img alt=""[热词系列_三连]"" src=""//i0.hdslb.com/bfs/emote/21f15fe11b7a84d2f2121c16dec50a4e4556f865.png@100w_100h.webp""/>";
山河无恙，举国同心；疫情已过，举国同进。;
第一个！武汉最美;
伟大的无产阶级万岁！;
钟老眼神中的自信 , 镇定的神态让我们让世界都感到可靠！每次看着钟老说话发布演讲，由衷的感到一种安心。  生在中华的自豪，生在有底蕴的大国，我认为是一种莫大的幸福。;
"为什么我们国家可以处理的这么好？中国现在发展得这么好不是没有原因的。政府一声令下，几乎所有人都待在家，各个地区严格管控，志愿者更是一批又一批，他们宁愿倒在志愿者岗位上也要守卫国家。人民相信国家，人们给白衣天使们鼓劲，国家就是人民，人民就是国家，谁都不会跟自己过不去吧？然而这在其他国家是很难很难做到的。这样的祖国怎能让人不爱<img alt=""[加油武汉]"" class=""small"" src=""//i0.hdslb.com/bfs/emote/eb966aaa5b690d3f9308a9f936f5b5a72a7f956b.png@100w_100h.webp""/>";
"是时候向世界贡献我们的中国方案了<img alt=""[鼓掌]"" class=""small"" src=""//i0.hdslb.com/bfs/emote/895d1fc616b4b6c830cf96012880818c0e1de00d.png@100w_100h.webp""/>";
"大国担当<img alt=""[口罩]"" class=""small"" src=""//i0.hdslb.com/bfs/emote/3ad2f66b151496d2a5fb0a8ea75f32265d778dd3.png@100w_100h.webp""/><img alt=""[口罩]"" class=""small"" src=""//i0.hdslb.com/bfs/emote/3ad2f66b151496d2a5fb0a8ea75f32265d778dd3.png@100w_100h.webp""/><img alt=""[支持]"" class=""small"" src=""//i0.hdslb.com/bfs/emote/3c210366a5585706c09d4c686a9d942b39feeb50.png@100w_100h.webp""/>";
中国预防疫情的经验，给予世界很好的示范！;
第一次这么早，当然中国必胜;
这次疫情使全世界都在关注武汉，全国人民也紧紧地心系武汉，我从来没有去过武汉，以前也不怎么关注武汉，但现在对武汉有着很深的感情，希望哪天去武汉看看。现在武汉的知名度可能是全世界最高的城市之一了，这也算是因祸得福吧，相信从明年开始，如果疫情结束，武汉将腾飞，前途不可限量。;
中国疫情遇上春节也是运气好，本来就回家过年，正好都各自待一下，也就隔离了。;
"做不到的，1 月 23 日 13 时 06 分，一封加急求助函送到了中国中元国际工程有限公司，函件出自武汉市城乡建设局，内容概括就是三个字：求图纸。仅仅过了 78 分钟，就将修订完成的小汤山医院图纸送到了武汉市城乡建设局。另一边，中信建筑设计研究总院接到了武汉火神山医院的紧急设计任务，便迅速组建起 60 余人的项目组。仅仅过了五个小时，就完成了场地平整设计图，24 小时就完成了方案设计图，60 小时便交付了全部施工图。重要的是这些图纸，中信设计研究总院无偿提供！1 月 23 日图纸还在设计之时，为了能够更快的竣工，火神山医院这边已经开始做起了前期准备。武汉市城建局 1 月 23 日成立了建设指挥部，协调组织施工单位迅速行动，人力和设备连夜进场，只争朝夕。在武汉的各个单位自愿请求为火神山医院的建设出战，并且立刻调配资源，连夜进行基础施工。经过一天一夜上千人，上百套机械设备的连续奋战，截至 1 月 24 日晚上，火神山医院选址处累计平整整个场地 5 万平方米，相当于七个足球场那么大。内转土方 15 万立方米，足以填满 57 个游泳池，一座小土山已被连夜铲平，碎石回填于除夕夜完成。想要在短时间兴建一座大医院，除了人力资源和设备资源之外，所需要的物资可想而知。物资需求量非常巨大：箱式板房需求量达 1600 间，各类门多达 1500 樘，混凝土需求达 1.4 万方，HDPE 膜需求量达 10 万平方米。春节时期，很多公司，工厂已经放假，物资买不到，物资买不够成为了一大难题。火神山医院采用的装配式建筑技术所需要的箱式房，一部分是全新的，一部分是中建三局拆了 5 个在汉项目工地的全部临建房，消毒后运过来。一家企业物资不够，多家企业来凑，甚至还用多个企业的多种型号来拼单，另外，也有很多企业给火神山医院建设，捐助了很多的物资。如果说箱式板房组成了火神山的 "" 躯体 ""，那么要让这个 "" 躯体 "" 活起来，还有赖于看不见的信息化系统。不过，传统的信息化系统显然是没有办法在 10 天之内建设完成，这时候，5G、云计算等先进的技术派上了用场。为此，中国电信为火神山医院提供方案规划、通信设施建设维护、重大保障、应急通信等一揽子服务。终于在 2 月 1 日火神山医院正式交付前全面完成医院固话、光纤、4G 和 5G 网络覆盖";
一家11人感染，三个重症，全部救回;
每个省援助一个市简直是神决策;
我的老家是广东唯一一个0感染的城市，五线小县城也派医护去援鄂了;
我们华夏民族，什么风浪没见过。我们华夏民族，与其说是个民族不如说是一种文明，一种刻到骨子里的信仰。;
"不带中国口罩带什么？纸尿裤吗？<img alt=""[妙啊]"" class=""small"" src=""//i0.hdslb.com/bfs/emote/b4cb77159d58614a9b787b91b1cd22a81f383535.png@100w_100h.webp""/>";
想想看有多少人嘴里说不要中国制造，结果回过头来连底裤都是made in china;
有本事不用中国制造，能不能活都是问题;
有本事你千万不用，用了我们举国上下瞧不起你;
"没了中国制造你们这些个沙雕能活得下去吗<img alt=""[翻白眼]"" class=""small"" src=""//i0.hdslb.com/bfs/emote/eba54707c7168925b18f6f8b1f48d532fe08c2b1.png@100w_100h.webp""/>";
科学不会到达的地方，文明会！;
美国学者：我不用中国制造……嘿！我的衣服，天哪！我的房子，oh no！给我留条内裤，求你了…;
"日本的一个节目就有，除去中国制造，最后只剩一条内裤<img alt=""[偷笑]"" class=""small"" src=""//i0.hdslb.com/bfs/emote/6c49d226e76c42cd8002abc47b3112bc5a92f66a.png@100w_100h.webp""/>采访街上那些阿婆啊妹也说打死不用中国制造，记者让他们看商标，make in china<img alt=""[偷笑]"" class=""small"" src=""//i0.hdslb.com/bfs/emote/6c49d226e76c42cd8002abc47b3112bc5a92f66a.png@100w_100h.webp""/>脸真疼";
中国制造他不香？骂完以后用上了是不是，艾玛，真香定律。肯定是。;
把家里房子拆了吧，顺便把衣服都脱了，手机电脑什么的全砸了，基本全是中国制造;
"北京上海机场一定要做好预防<img alt=""[难过]"" class=""small"" src=""//i0.hdslb.com/bfs/emote/a651db36701610aa70a781fa98c07c9789b11543.png@100w_100h.webp""/>今天下午郑州有确诊一例输入病例";
中国在本国疫情结束之后的产能有出路了，全世界都急需医疗物资;
突然想到前段时候和昨晚发生的事…前段时候我因为外婆去世，同父亲一起去往外婆那里，走到小区门口看到停在路边的很多私家车都被贴了单子。第一反应是罚单…我爸张嘴就说政府没钱了么，现在什么时候还要靠这个赚钱…我我好奇走过去看了下，发现并不是罚单是一则提醒，提醒此处不该停车…疫情期间特出情况下不罚款。请车主回来尽快驶离，盖着交警大队的公章而已…这让我看到了人性化的一面。昨晚开车回家突然前面开始堵了…走近点发现查酒驾…以前什么样呢，走到跟前敬个礼敲窗户然后一句冷冰冰的“吹一下，好走吧”。昨晚是这样的到了我之后敬礼先问了我一句…没喝酒吧，我说没（并没吹气）警察说那就好，接着说“现在这个时候还不能放松阿，要戴好口罩阿，注意安全，慢点开车”说着指挥我驶离（因为我在车上忘记戴口罩，在快到警察面前戴上的）我竟然感觉到以前电视里经常提到的人性化，幸福感…就在我面前，感觉到这个城市的温度。感觉到在中国的我很好！;
从经济上来说，个人感觉这次疫情过后资本流向可能会转向中国，中国国际地位会直线上升。这是一次大考，我们已经做出选择，只差一份喜报了。;
"总结：社会主义好<img alt=""[微笑]"" class=""small"" src=""//i0.hdslb.com/bfs/emote/685612eadc33f6bc233776c6241813385844f182.png@100w_100h.webp""/>";
我是湖北人，我来说一下什么是封城，我五十多天没出过家门，上个星期才刚放出来，现在还是只能在市里活动，无法离开市区。;
"1. 隔离设施：封城（大范围无差别隔离）--&gt;方舱（小范围隔离确诊轻症病例）--&gt;火神山等医院（支持性治疗重症）2. 检测疑似病例：1) 出入限制+出入口体温时时检测， 2)14天家中或指定场所自我隔离3. 确诊方式：发热门诊隔开疑似病例和其他病人，免费检测治疗，快速确诊。4. 运输方式：专车接送，防止传染5. 预防手段：佩戴口罩+定时消毒6. 小区限行：住户出入门卡+禁止外人进入";
3分30秒中说我国平均花费一百万才能把一个人从鬼门关里拉出来，不知道这里指的是不是重症，如果不是的话那数据有误。已经有数据出来了，我国截止至3.15的数据，人均治疗费用为1.7万元。;
在2月25日广州市政府举行的新闻发布会上，广州市第八人民医院感染病中心ICU主任李粤平称，医院在出院随访中发现复阳病人13人，这些患者没有出现症状再次加重的情况。104个密切接触者接受了核酸检测，结果均为阴性。其他省份也出现了类似情况。海南省卫健委发布消息称，个别患者出院后定期复查，核酸检测呈阳性。海南卫健委建议所有出院病人均集中隔离观察14天，并在隔离期满时进行咽拭子和粪便检测。两项检测均为阴性时，出院病人才能解除隔离。在出院满四周时，相关人员还应再次接受复诊复查。（来自某新闻通稿）;
"并不是鼠年有毒，只是鼠是老大，它想把所有的灾难都扛在自己肩上，确保接下来的11年风调雨顺，国泰民安<img alt=""[老鼠]"" class=""small"" src=""//i0.hdslb.com/bfs/emote/8e6fb491eb1bb0d5862e7ec8ccf9a3da12b6c155.png@100w_100h.webp""/>";
我就在北京，真没你们想的那么严重，我们小区离新发地也就是疫情区十公里左右吧，小区周围也没听说有感染什么的。;
想找在北京找个托，朝阳区人民那愛国战斗力就是代表。;
别世界惊叹了行不行？我在国外，评论基本上是中国更应该为世界所有人默哀中国要为全世界谢罪！醒醒吧，危难时刻没人会记得你的好！谁都想咬你一口！我们只需要自己做好就行了，干嘛还需要得到外国的承认？中国面临的舆论压力前所未有，接下来的路还会更加曲折，放弃幻想，打铁还需自身硬！;
听到外国人夸中国，不要自满，更不能满足现状。要时刻记得，我们还不够富裕，不够强大，不够先进，在科学和技术方面，我们距离美国，德国，日本等还有差距，要切忌骄傲自满。等我们补齐了所有的短板，才能拍着胸脯说：成了，可以骄傲一下了！;
"想起了白岩松老师的讲话：""希望很多人不要膨胀，我们之所以会有经验是因为我们仗打得比较早，打得比较大，我们也付出了相当多的代价。能对自己国家精准定位，绝不膨胀，也学习别人的优点知道自己的不足，这是真正的爱国。""";
此次疫情中国社会最大的损失是什么？第一，经济损失和生命损失；第二，加剧了对英美西方的轻视之意。前一种代表着过去的不幸，后一种代表着未来的风险。 说起来，后一种风险更加可怖 ;
"这次疫情也给中国敲响了警钟，坚持以公有制为主体的医疗制度，才是人民生命的坚实保障<img alt=""[打call]"" class=""small"" src=""//i0.hdslb.com/bfs/emote/431432c43da3ee5aab5b0e4f8931953e649e9975.png@100w_100h.webp""/>";
虽然说这样子很好，但是还是希望给我们的白衣天使们涨工资。提福利，特别是医闹方面的。他们觉得自己不要钱，不代表我们就不可以给他们更好的福利。;
"虽然在这么一次赞扬中国成果，剖析美国问题的正能量视频里说这些可能不太好。但是我还是要说，请警惕！没有什么是可以真正多快好省的，这4%gdp的超低医疗投入下牺牲的是医疗从业者，如果抛去那些光鲜靓丽的头部专家大牛，看一个普通医疗人员的职业生涯，简直可以用艰辛困苦来形容，大家都看得起病挂的起号的基础上并没有经济投入来吸引更多医疗人员的加入，只会加重医疗工作的负担，那些看似很敬业很感人的楼道睡觉，吃不上饭，连续作业的故事，赤裸裸的控诉着行业内高强度透支的现实，而在这样的现状下，能分给每个病人的精力又有多少，又能拿出多少时间为他们提供细致的咨询和关怀呢，这残酷的现状与病人缺乏医疗认知的过高期待之间的矛盾，又进一步激化出医患关系问题，医闹伤医事件频发，反过来毒化医疗环境，倒逼医生转化，加剧医患比例失衡，恶性循环。还有太多太多背后的苦楚实在不指望非业内认识能够理解，就简单一句话家里人的关心：你那么好的成绩考的上名牌大学医学系，又保研读博的认真读书，如果去干………会不会………请不要神话医疗人员，他们本就秉持着高尚的职业道德与荣誉感在负重前行，请给他们应有的尊重与理解。<img alt=""[拥抱]"" class=""small"" src=""//i0.hdslb.com/bfs/emote/41780a4254750cdaaccb20735730a36044e98ef3.png@100w_100h.webp""/>";
要把尊敬医生、老师、普通工人等等编入中小学教材，提高老师和医生工资的待遇以及准入门槛，在医院建立全面安保体系，更要建立医闹黑名单。这些事情任重道远，但是必须要行动了;
"我就是个医学生，大学实习的时候非但没有实习费，而且还要照常出实习费用，工作了第一个月工资1100，而且还要持续3年（就是国家出的规培政策），你们看到的医保低价是因为吸的我们医生的血，在美国，医生算高收入人群，在中国，医生的平均工资刚刚够社会平均工资，你说我们难不难？？？<img alt=""[热词系列_我太南了]"" src=""//i0.hdslb.com/bfs/emote/a523f3e4c63e4db1232365765d0ec452f83be97e.png@100w_100h.webp""/><img alt=""[热词系列_我太南了]"" src=""//i0.hdslb.com/bfs/emote/a523f3e4c63e4db1232365765d0ec452f83be97e.png@100w_100h.webp""/><img alt=""[热词系列_我太南了]"" src=""//i0.hdslb.com/bfs/emote/a523f3e4c63e4db1232365765d0ec452f83be97e.png@100w_100h.webp""/>";
其实，中国这个医疗保险，是医生，医疗系统和政府在买单。这也是为什么医生现在越来越少。;
钟院士专家号一千有人嫌贵，明星演唱会2000有人有人觉得便宜。;
作为金融行业工作者，看了这个视频丝毫不觉得感动，只觉得难受。大家满屏幕的致敬，为生于斯长于斯而骄傲，这很好。但是没有人想到以后，给医生这么低的待遇，让一个高知识高风险的职业没有与之匹配的高收入，这是不可持续的！这样只会让从业者越来越少，而最近几年的高考医科类招生情况恰恰反映了这一点。如果10年以后，再遇到这样的疫情，还会有足够多医护人员保护我们吗？我很怀疑也很忧虑。我希望大家能够重视自己的健康和生存，而不是当作理所当然。我见过我的同事一边炫耀自己几万的lv包一边想着去看皮肤病能不能免个几十块的挂号费，我就很恶心了，你的身体发肤都比不上一件身外之物有价值？都不值得你花钱？买奢侈品觉得多贵都值得，医生救你命就舍不得花钱？很费解😒;
头一次见到夸中国医疗改革的，门外汉确实是门外汉。中国的医疗现状还可以，靠的全是医护人员的死撑。低廉的劳动力而已。而现在，每年的医学生还有医疗行业的从业人员逐年都在减少。我们未来的医疗行业问题，比美国更大。因为我们没有美国有钱。;
